,Zip Code,Publication Name,ULCS Code,Income,Denom,Num,Graduation Percent,StudentEnrollment,IEPCount,IEPPCT,NotIEPCount,NotIEPPCT,FemaleCount,FemalePCT,MaleCount,MalePCT,BlackAACount,BlackAAPCT,WhiteCount,WhitePCT,EconDisadvRate,OtherRaceCount,OtherRacePCT,Number of Graduates,First-Fall Matriculation Rate
0,19132,Richard R. Wright School,4470,26041,,,,,,,,,,,,,,,,,,,,,
1,19132,TECH Freire Charter School,3441,26041,,,,,,,,,,,,,,,,,,,,,
2,19132,Murrell Dobbins Career and Technical High School,4060,26041,195.0,158,81.03,774.0,182.0,23.51,592.0,76.49,408.0,52.71,366.0,47.29,692.0,89.41,7.0,0.9,100.0,75.0,9.69,158.0,25.95
3,19132,E. Washington Rhodes School,4350,26041,,,,,,,,,,,,,,,,,,,,,
4,19132,Thomas M. Peirce School,4380,26041,,,,,,,,,,,,,,,,,,,,,
5,19132,Dr. Ethel Allen School,4440,26041,,,,,,,,,,,,,,,,,,,,,
6,19132,KIPP North Philadelphia Charter School,3437,26041,,,,,,,,,,,,,,,,,,,,,
7,19132,YESPhilly,8450,26041,52.0,2,3.85,126.0,13.0,10.32,113.0,89.68,71.0,56.35,55.0,43.65,115.0,91.27,3.0,2.38,100.0,8.0,6.35,,
8,19132,KIPP Philadelphia Charter School,3370,26041,,,,,,,,,,,,,,,,,,,,,
22,19140,Mastery Charter School at Cleveland,3420,27006,,,,,,,,,,,,,,,,,,,,,
23,19140,Thomas A. Edison High School,5020,27006,285.0,156,54.74,897.0,270.0,30.1,627.0,69.9,431.0,48.05,465.0,51.84,271.0,30.21,12.0,1.34,100.0,612.0,68.23,169.0,17.16
24,19140,Mastery Prep Elementary Charter School,3439,27006,,,,,,,,,,,,,,,,,,,,,
25,19140,Esperanza Academy Charter School,3333,27006,,,,,,,,,,,,,,,,,,,,,
29,19140,Edward T. Steel School,6390,27006,,,,,,,,,,,,,,,,,,,,,
27,19140,The LINC,5660,27006,31.0,25,80.65,228.0,41.0,17.98,187.0,82.02,113.0,49.56,115.0,50.44,84.0,36.84,9.0,3.95,100.0,135.0,59.21,28.0,17.86
28,19140,Crossroads at Hunting Park,3190,27006,,,,,,,,,,,,,,,,,,,,,
21,19140,Laboratory Charter School of Communication and Languages,3310,27006,,,,,,,,,,,,,,,,,,,,,
26,19140,Antonia Pantoja Charter School,3395,27006,,,,,,,,,,,,,,,,,,,,,
20,19140,Kenderton Elementary School,4360,27006,,,,,,,,,,,,,,,,,,,,,
16,19140,Philadelphia Learning Academy North,8470,27006,27.0,1,3.7,88.0,20.0,22.73,68.0,77.27,32.0,36.36,56.0,63.64,71.0,80.68,0.0,0.0,100.0,17.0,19.32,,
18,19140,Alexander K. McClure School,7380,27006,,,,,,,,,,,,,,,,,,,,,
17,19140,Multicultural Academy Charter School,3312,27006,,,,,,,,,,,,,,,,,,,,,
15,19140,Mastery Charter School at Gratz,3416,27006,,,,,,,,,,,,,,,,,,,,,
14,19140,Honorable Luis Munoz-Marin School,5680,27006,,,,,,,,,,,,,,,,,,,,,
13,19140,Roberto Clemente School,7730,27006,,,,,,,,,,,,,,,,,,,,,
12,19140,William Cramp School,5470,27006,,,,,,,,,,,,,,,,,,,,,
11,19140,Bayard Taylor School,7440,27006,,,,,,,,,,,,,,,,,,,,,
10,19140,Achieve Academy East,3820,27006,2.0,s,s,55.0,5.0,9.09,50.0,90.91,21.0,38.18,34.0,61.82,37.0,67.27,0.0,0.0,100.0,18.0,32.73,,
9,19140,Mary M. Bethune School,7510,27006,,,,,,,,,,,,,,,,,,,,,
19,19140,Cayuga School,5490,27006,,,,,,,,,,,,,,,,,,,,,
35,19133,Isaac A. Sheppard School,5410,27811,,,,,,,,,,,,,,,,,,,,,
38,19133,John F. Hartranft School,5320,27811,,,,,,,,,,,,,,,,,,,,,
37,19133,William H. Hunter School,5330,27811,,,,,,,,,,,,,,,,,,,,,
34,19133,Mastery Charter School at Clymer,3415,27811,,,,,,,,,,,,,,,,,,,,,
36,19133,Potter-Thomas School,5390,27811,,,,,,,,,,,,,,,,,,,,,
32,19133,Julia de Burgos School,5170,27811,,,,,,,,,,,,,,,,,,,,,
31,19133,One Bright Ray - Fairhill Campus,8190,27811,103.0,11,10.68,261.0,27.0,10.34,234.0,89.66,134.0,51.34,127.0,48.66,108.0,41.38,5.0,1.92,0.61,148.0,56.71,,
30,19133,John Welsh School,5420,27811,,,,,,,,,,,,,,,,,,,,,
33,19133,Pan American Academy Charter School,3394,27811,,,,,,,,,,,,,,,,,,,,,
55,19121,One Bright Ray Mansion,8860,29691,53.0,6,11.32,105.0,14.0,13.33,91.0,86.67,64.0,60.95,41.0,39.05,92.0,87.62,0.0,0.0,100.0,13.0,12.38,,
54,19121,William D. Kelley School,4560,29691,,,,,,,,,,,,,,,,,,,,,
52,19121,Strawberry Mansion High School,4140,29691,3.0,s,s,249.0,108.0,43.37,141.0,56.63,116.0,46.59,130.0,52.21,230.0,92.37,5.0,2.01,100.0,14.0,5.62,2.0,0.0
51,19121,One Bright Ray Mansion Evening,8870,29691,82.0,34,41.46,79.0,3.0,3.8,76.0,96.2,66.0,83.54,13.0,16.46,70.0,88.61,1.0,1.27,0.0,8.0,10.13,,
50,19121,Robert Morris School,2390,29691,,,,,,,,,,,,,,,,,,,,,
49,19121,Edward Gideon School,4530,29691,,,,,,,,,,,,,,,,,,,,,
48,19121,El Centro de Estudiantes (Big Picture),3510,29691,69.0,11,15.94,100.0,9.0,9.0,91.0,91.0,49.0,49.0,51.0,51.0,52.0,52.0,7.0,7.0,1.6,41.0,41.0,,
47,19121,Vaux High School: A Big Picture,5180,29691,100.0,87,87,305.0,79.0,25.9,226.0,74.1,157.0,51.48,148.0,48.52,273.0,89.51,2.0,0.66,1.05,30.0,9.84,94.0,36.17
53,19121,Excel Academy North,8080,29691,69.0,11,15.94,208.0,33.0,15.87,175.0,84.13,125.0,60.1,83.0,39.9,191.0,91.83,4.0,1.92,100.0,13.0,6.25,,
45,19121,General George G. Meade School,4570,29691,,,,,,,,,,,,,,,,,,,,,
44,19121,James G. Blaine School,4220,29691,,,,,,,,,,,,,,,,,,,,,
43,19121,William Dick School,4270,29691,,,,,,,,,,,,,,,,,,,,,
42,19121,Alliance For Progress Charter School,3315,29691,,,,,,,,,,,,,,,,,,,,,
41,19121,Tanner G. Duckrey School,4460,29691,,,,,,,,,,,,,,,,,,,,,
40,19121,Mastery Charter School at Douglass,3412,29691,,,,,,,,,,,,,,,,,,,,,
39,19121,High School of Engineering and Science,4030,29691,199.0,196,98.49,843.0,38.0,4.51,805.0,95.49,386.0,45.79,456.0,54.09,497.0,58.96,73.0,8.66,92.43,273.0,32.38,198.0,78.79
46,19121,Achieve Academy,2310,29691,10.0,5,50,50.0,5.0,10.0,45.0,90.0,28.0,56.0,22.0,44.0,46.0,92.0,0.0,0.0,100.0,4.0,8.0,,
67,19104,Inquiry Charter School,3308,30734,,,,,,,,,,,,,,,,,,,,,
66,19104,Sadie Alexander School,1280,30734,,,,,,,,,,,,,,,,,,,,,
65,19104,Excel Middle Years Academy,3040,30734,,,,,,,,,,,,,,,,,,,,,
64,19104,Morton McMichael School,1360,30734,,,,,,,,,,,,,,,,,,,,,
63,19104,Samuel Powel School,1390,30734,,,,,,,,,,,,,,,,,,,,,
62,19104,Belmont Charter School,3368,30734,,,,,,,,,,,,,,,,,,,,,
60,19104,Science Leadership Academy Middle School,2050,30734,,,,,,,,,,,,,,,,,,,,,
59,19104,Martha Washington School,1420,30734,,,,,,,,,,,,,,,,,,,,,
58,19104,Crossroads Accelerated Academy,8690,30734,4.0,s,s,58.0,8.0,13.79,50.0,86.21,29.0,50.0,29.0,50.0,53.0,91.38,1.0,1.72,100.0,4.0,6.9,,
57,19104,High School of the Future,1030,30734,148.0,125,84.46,560.0,138.0,24.64,422.0,75.36,277.0,49.46,282.0,50.36,517.0,92.32,6.0,1.07,100.0,37.0,6.6,133.0,35.34
56,19104,Paul Robeson High School for Human Services,1050,30734,81.0,78,96.3,291.0,59.0,20.27,232.0,79.73,160.0,54.98,131.0,45.02,278.0,95.53,2.0,0.69,100.0,11.0,3.78,79.0,39.24
61,19104,Philadelphia Learning Academy West,8460,30734,31.0,10,32.26,60.0,13.0,21.67,47.0,78.33,25.0,41.67,35.0,58.33,58.0,96.67,0.0,0.0,100.0,2.0,3.33,,
75,19139,West Philadelphia High School,1020,32531,102.0,71,69.61,601.0,202.0,33.61,399.0,66.39,275.0,45.76,326.0,54.24,530.0,88.19,6.0,1.0,100.0,62.0,10.32,81.0,35.8
78,19139,KIPP Octavius Catto Charter School,3436,32531,,,,,,,,,,,,,,,,,,,,,
77,19139,Middle Years Alternative School,1580,32531,,,,,,,,,,,,,,,,,,,,,
76,19139,Alain Locke School,1470,32531,,,,,,,,,,,,,,,,,,,,,
74,19139,James Rhoads School,1410,32531,,,,,,,,,,,,,,,,,,,,,
79,19139,Andrew Hamilton School,1290,32531,,,,,,,,,,,,,,,,,,,,,
72,19139,John Barry School,1200,32531,,,,,,,,,,,,,,,,,,,,,
71,19139,Henry C. Lea School,1340,32531,,,,,,,,,,,,,,,,,,,,,
70,19139,The Workshop School,8560,32531,53.0,41,77.36,189.0,56.0,29.63,133.0,70.37,61.0,32.28,128.0,67.72,173.0,91.53,2.0,1.06,100.0,14.0,7.42,42.0,35.71
69,19139,Phila. Juv. Justice Services Ctr.,2530,32531,41.0,1,2.44,210.0,96.0,45.71,114.0,54.29,24.0,11.43,186.0,88.57,174.0,82.86,6.0,2.86,13.71,30.0,14.29,,
68,19139,Parkway West High School,5090,32531,62.0,53,85.48,167.0,49.0,29.34,118.0,70.66,90.0,53.89,77.0,46.11,150.0,89.82,0.0,0.0,100.0,17.0,10.19,55.0,38.18
73,19139,William L. Sayre High School,1100,32531,104.0,74,71.15,426.0,159.0,37.32,267.0,62.68,205.0,48.12,221.0,51.88,385.0,90.38,3.0,0.7,100.0,38.0,8.92,85.0,23.53
88,19141,Julia W. Howe School,7320,34651,,,,,,,,,,,,,,,,,,,,,
87,19141,Prince Hall School,7490,34651,,,,,,,,,,,,,,,,,,,,,
85,19141,Philadelphia High School for Girls,6050,34651,135.0,125,92.59,724.0,39.0,5.39,685.0,94.61,715.0,98.76,1.0,0.14,489.0,67.54,32.0,4.42,100.0,203.0,28.04,125.0,76.0
84,19141,Central High School,6010,34651,600.0,593,98.83,2288.0,45.0,1.97,2243.0,98.03,1254.0,54.81,1021.0,44.62,489.0,21.37,631.0,27.58,86.5,1168.0,51.05,593.0,88.53
86,19141,Jay Cooke School,7100,34651,,,,,,,,,,,,,,,,,,,,,
82,19141,Joseph Pennell School,6340,34651,,,,,,,,,,,,,,,,,,,,,
81,19141,James Logan School,6300,34651,,,,,,,,,,,,,,,,,,,,,
80,19141,Widener Memorial School,6400,34651,13.0,3,23.08,137.0,130.0,94.89,7.0,5.11,53.0,38.69,84.0,61.31,63.0,45.99,18.0,13.14,100.0,56.0,40.88,12.0,8.33
83,19141,Lindley Academy Charter at Birney,3419,34651,,,,,,,,,,,,,,,,,,,,,
89,19144,Anna L. Lingelbach School,6440,37322,,,,,,,,,,,,,,,,,,,,,
90,19144,Wissahickon Charter School,3362,37322,,,,,,,,,,,,,,,,,,,,,
91,19144,Theodore Roosevelt School,6360,37322,,,,,,,,,,,,,,,,,,,,,
92,19144,Mastery Charter School at Wister,3427,37322,,,,,,,,,,,,,,,,,,,,,
93,19144,Fitler Academics Plus School,6230,37322,,,,,,,,,,,,,,,,,,,,,
94,19144,John B. Kelly School,6470,37322,,,,,,,,,,,,,,,,,,,,,
95,19144,Mastery Charter School at Pickett,3393,37322,,,,,,,,,,,,,,,,,,,,,
101,19142,One Bright Ray - Elmwood Campus,3810,37621,44.0,4,9.09,126.0,12.0,9.52,114.0,90.48,62.0,49.21,64.0,50.79,121.0,96.03,0.0,0.0,0.0,5.0,3.97,,
103,19142,Joseph W. Catharine School,1250,37621,,,,,,,,,,,,,,,,,,,,,
102,19142,Southwest Leadership Academy Charter School,3392,37621,,,,,,,,,,,,,,,,,,,,,
100,19142,John M. Patterson School,1400,37621,,,,,,,,,,,,,,,,,,,,,
98,19142,Philadelphia Montessori Charter School,3378,37621,,,,,,,,,,,,,,,,,,,,,
97,19142,John Bartram High School,1010,37621,157.0,114,72.61,526.0,129.0,24.52,397.0,75.48,241.0,45.82,284.0,53.99,405.0,77.0,1.0,0.19,100.0,120.0,22.81,120.0,25.83
96,19142,William T. Tilden School,1130,37621,,,,,,,,,,,,,,,,,,,,,
99,19142,Thomas G. Morton School,1380,37621,,,,,,,,,,,,,,,,,,,,,
111,19134,Lewis Elkin School,5260,37821,,,,,,,,,,,,,,,,,,,,,
114,19134,Richmond School,5400,37821,,,,,,,,,,,,,,,,,,,,,
113,19134,Frances E. Willard School,5440,37821,,,,,,,,,,,,,,,,,,,,,
112,19134,"Stetson, John B. Middle School",5580,37821,,,,,,,,,,,,,,,,,,,,,
110,19134,Stetson Middle School Continuation Academy,5581,37821,,,,,,,,,,,,,,,,,,,,,
109,19134,Russell H. Conwell School,5230,37821,,,,,,,,,,,,,,,,,,,,,
108,19134,Jules E. Mastbaum Area Vocational Technical High School,5060,37821,105.0,77,73.33,591.0,148.0,25.04,443.0,74.96,260.0,43.99,330.0,55.84,255.0,43.15,27.0,4.57,100.0,309.0,52.28,79.0,20.25
107,19134,John H. Webster School,5590,37821,,,,,,,,,,,,,,,,,,,,,
106,19134,Gloria Casarez Elementary School,5530,37821,,,,,,,,,,,,,,,,,,,,,
105,19134,Memphis Street Academy Charter School at J.P. Jones,3423,37821,,,,,,,,,,,,,,,,,,,,,
104,19134,Deep Roots Charter School,3438,37821,,,,,,,,,,,,,,,,,,,,,
126,19124,Excel Academy South,3290,38293,156.0,14,8.97,207.0,38.0,18.36,169.0,81.64,85.0,41.06,122.0,58.94,100.0,48.31,25.0,12.08,100.0,82.0,39.62,,
127,19124,Community Academy of Philadelphia Charter School,3301,38293,,,,,,,,,,,,,,,,,,,,,
128,19124,One Bright Ray Simpson - Evening,8891,38293,21.0,s,s,131.0,8.0,6.11,123.0,93.89,101.0,77.1,30.0,22.9,53.0,40.46,7.0,5.34,0.0,71.0,54.2,,
125,19124,Mastery Charter School at Smedley,3409,38293,,,,,,,,,,,,,,,,,,,,,
131,19124,One Bright Ray - Simpson Campus,8890,38293,101.0,11,10.89,267.0,32.0,11.99,235.0,88.01,123.0,46.07,144.0,53.93,102.0,38.2,10.0,3.75,0.0,155.0,58.05,,
130,19124,Mariana Bracetti Academy Charter School,3332,38293,,,,,,,,,,,,,,,,,,,,,
129,19124,Northwood Academy Charter School,3386,38293,,,,,,,,,,,,,,,,,,,,,
124,19124,Frankford High School,7010,38293,233.0,131,56.22,861.0,51.0,5.92,810.0,94.08,359.0,41.7,502.0,58.3,347.0,40.3,53.0,6.16,100.0,461.0,53.54,151.0,21.85
116,19124,Samuel Fels High School,7120,38293,235.0,156,66.38,1238.0,226.0,18.26,1012.0,81.74,574.0,46.37,664.0,53.63,475.0,38.37,49.0,3.96,100.0,714.0,57.66,166.0,27.71
122,19124,The Philadelphia Charter School for Arts and Sciences,3422,38293,,,,,,,,,,,,,,,,,,,,,
121,19124,James J. Sullivan School,7430,38293,,,,,,,,,,,,,,,,,,,,,
120,19124,John Marshall School,7360,38293,,,,,,,,,,,,,,,,,,,,,
119,19124,Francis Hopkinson School,7300,38293,,,,,,,,,,,,,,,,,,,,,
118,19124,First Philadelphia Preparatory Charter School,3364,38293,,,,,,,,,,,,,,,,,,,,,
117,19124,Allen M. Stearne School,7290,38293,,,,,,,,,,,,,,,,,,,,,
115,19124,Warren G. Harding School,7110,38293,,,,,,,,,,,,,,,,,,,,,
123,19124,Juniata Park Academy,7150,38293,,,,,,,,,,,,,,,,,,,,,
144,19143,Add B. Anderson School,1460,38928,,,,,,,,,,,,,,,,,,,,,
143,19143,Richard Allen Preparatory Charter School,3359,38928,,,,,,,,,,,,,,,,,,,,,
142,19143,Mastery Charter School at Hardy Williams,3323,38928,,,,,,,,,,,,,,,,,,,,,
140,19143,Mastery Charter School at Harrity,3407,38928,,,,,,,,,,,,,,,,,,,,,
139,19143,Independence Charter School West,3442,38928,,,,,,,,,,,,,,,,,,,,,
138,19143,Global Leadership Academy at Huey,3428,38928,,,,,,,,,,,,,,,,,,,,,
141,19143,Boys Latin of Philadelphia Charter School,3388,38928,,,,,,,,,,,,,,,,,,,,,
136,19143,William C. Bryant School,1230,38928,,,,,,,,,,,,,,,,,,,,,
135,19143,Benjamin B. Comegys School,1260,38928,,,,,,,,,,,,,,,,,,,,,
134,19143,William C. Longstreth School,1350,38928,,,,,,,,,,,,,,,,,,,,,
133,19143,Avery D. Harrington School,1300,38928,,,,,,,,,,,,,,,,,,,,,
132,19143,S. Weir Mitchell School,1370,38928,,,,,,,,,,,,,,,,,,,,,
137,19143,Motivation High School,1190,38928,81.0,76,93.83,239.0,42.0,17.57,197.0,82.43,114.0,47.7,124.0,51.88,221.0,92.47,2.0,0.84,100.0,16.0,6.7,79.0,44.3
156,19131,Mastery Charter School at Shoemaker,3383,42309,,,,,,,,,,,,,,,,,,,,,
155,19131,Mastery Charter School at Mann,3408,42309,,,,,,,,,,,,,,,,,,,,,
154,19131,Discovery Charter School,3372,42309,,,,,,,,,,,,,,,,,,,,,
153,19131,KIPP DuBois Charter School,3353,42309,,,,,,,,,,,,,,,,,,,,,
152,19131,Rudolph Blankenburg School,1490,42309,,,,,,,,,,,,,,,,,,,,,
151,19131,The Science Leadership Academy at Beeber,2680,42309,107.0,103,96.26,558.0,33.0,5.91,525.0,94.09,276.0,49.46,281.0,50.36,425.0,76.16,56.0,10.04,86.88,77.0,13.8,104.0,75.0
149,19131,Samuel Gompers School,4280,42309,,,,,,,,,,,,,,,,,,,,,
148,19131,Guion S. Bluford Elementary School,4520,42309,,,,,,,,,,,,,,,,,,,,,
147,19131,KIPP West Philadelphia Charter School,3443,42309,,,,,,,,,,,,,,,,,,,,,
146,19131,Edward Heston School,4300,42309,,,,,,,,,,,,,,,,,,,,,
145,19131,Overbrook High School,4020,42309,99.0,71,71.72,394.0,89.0,22.59,305.0,77.41,190.0,48.22,204.0,51.78,354.0,89.85,2.0,0.51,100.0,38.0,9.65,73.0,19.18
150,19131,Global Leadership Academy Charter School,3337,42309,,,,,,,,,,,,,,,,,,,,,
162,19122,Philadelphia Military Academy,5050,43981,65.0,60,92.31,320.0,117.0,36.56,203.0,63.44,119.0,37.19,201.0,62.81,202.0,63.13,10.0,3.13,100.0,108.0,33.75,61.0,31.15
163,19122,James R. Ludlow School,5340,43981,,,,,,,,,,,,,,,,,,,,,
161,19122,William McKinley School,5350,43981,,,,,,,,,,,,,,,,,,,,,
164,19122,Paul L. Dunbar School,5250,43981,,,,,,,,,,,,,,,,,,,,,
159,19122,Kensington High School for Creative and Performing Arts,5520,43981,130.0,94,72.31,503.0,135.0,26.84,368.0,73.16,276.0,54.87,227.0,45.13,171.0,34.0,27.0,5.37,100.0,305.0,60.64,101.0,21.78
157,19122,The U School,5620,43981,40.0,29,72.5,204.0,53.0,25.98,151.0,74.02,113.0,55.39,89.0,43.63,154.0,75.49,4.0,1.96,100.0,46.0,22.55,31.0,35.48
160,19122,John Moffet School,5370,43981,,,,,,,,,,,,,,,,,,,,,
158,19122,YouthBuild Philadelphia Charter School,3304,43981,,,,,,,,,,,,,,,,,,,,,
173,19120,"Grover Washington, Jr. School",7370,44195,,,,,,,,,,,,,,,,,,,,,
178,19120,James R. Lowell School,7350,44195,,,,,,,,,,,,,,,,,,,,,
177,19120,Benjamin Franklin School,7280,44195,,,,,,,,,,,,,,,,,,,,,
176,19120,Universal Charter School at Creighton,3421,44195,,,,,,,,,,,,,,,,,,,,,
175,19120,Thomas K. Finletter School,7270,44195,,,,,,,,,,,,,,,,,,,,,
174,19120,Clara Barton School,7200,44195,,,,,,,,,,,,,,,,,,,,,
179,19120,Excel Academy Central,3291,44195,,,,,,,,,,,,,,,,,,,,,
172,19120,Olney HS Continuation Academy,7061,44195,,,,,,,,,,,,,,,,,,,,,
170,19120,Andrew J. Morrison School,7390,44195,,,,,,,,,,,,,,,,,,,,,
169,19120,Olney School,7400,44195,,,,,,,,,,,,,,,,,,,,,
168,19120,Feltonville School of Arts and Sciences,7500,44195,,,,,,,,,,,,,,,,,,,,,
167,19120,Feltonville Intermediate School,7310,44195,,,,,,,,,,,,,,,,,,,,,
166,19120,Thurgood Marshall School,5500,44195,,,,,,,,,,,,,,,,,,,,,
165,19120,Eugenio Maria De Hostos Charter School,3307,44195,,,,,,,,,,,,,,,,,,,,,
171,19120,Olney High School,7060,44195,17.0,s,s,1215.0,274.0,22.55,941.0,77.45,516.0,42.47,699.0,57.53,451.0,37.12,10.0,0.82,100.0,754.0,62.05,,
186,19138,Mastery Charter School at Pastorius,3426,44455,,,,,,,,,,,,,,,,,,,,,
182,19138,West Oak Lane Charter School,3314,44455,,,,,,,,,,,,,,,,,,,,,
187,19138,Parkway Northwest High School,5070,44455,54.0,50,92.59,219.0,32.0,14.61,187.0,85.39,107.0,48.86,112.0,51.14,202.0,92.24,0.0,0.0,100.0,17.0,7.76,50.0,48.0
185,19138,Imhotep Institute Charter High School,3309,44455,,,,,,,,,,,,,,,,,,,,,
180,19138,Anna B. Day School,6200,44455,,,,,,,,,,,,,,,,,,,,,
183,19138,Martin Luther King High School,6060,44455,117.0,53,45.3,538.0,170.0,31.6,368.0,68.4,238.0,44.24,299.0,55.58,492.0,91.45,6.0,1.12,100.0,40.0,7.43,65.0,15.38
181,19138,Building 21,5610,44455,72.0,68,94.44,383.0,97.0,25.33,286.0,74.67,183.0,47.78,200.0,52.22,345.0,90.08,0.0,0.0,100.0,38.0,9.92,71.0,23.94
184,19138,Samuel Pennypacker School,6350,44455,,,,,,,,,,,,,,,,,,,,,
188,19135,Hamilton Disston School,8240,46311,,,,,,,,,,,,,,,,,,,,,
189,19135,MaST Community Charter School II,3440,46311,,,,,,,,,,,,,,,,,,,,,
190,19135,Henry W. Lawton School,7330,46311,,,,,,,,,,,,,,,,,,,,,
191,19135,Keystone Academy Charter School,3389,46311,,,,,,,,,,,,,,,,,,,,,
192,19151,Ad Prima Charter School,3379,49337,,,,,,,,,,,,,,,,,,,,,
193,19151,Robert E. Lamberton School,4320,49337,,,,,,,,,,,,,,,,,,,,,
194,19151,Overbrook Educational Center,4480,49337,,,,,,,,,,,,,,,,,,,,,
195,19151,Harambee Institute of Science and Technology Charter School,3302,49337,,,,,,,,,,,,,,,,,,,,,
196,19151,Lewis C. Cassidy Academics Plus School,4240,49337,,,,,,,,,,,,,,,,,,,,,
197,19151,West Philadelphia Achievement Charter School,3357,49337,,,,,,,,,,,,,,,,,,,,,
198,19151,Overbrook Elementary School,4370,49337,,,,,,,,,,,,,,,,,,,,,
202,19149,Ethan Allen School,8200,50592,,,,,,,,,,,,,,,,,,,,,
203,19149,Solomon Solis-Cohen School,8340,50592,,,,,,,,,,,,,,,,,,,,,
201,19149,Gilbert Spruance School,8350,50592,,,,,,,,,,,,,,,,,,,,,
199,19149,Mayfair School,8300,50592,,,,,,,,,,,,,,,,,,,,,
200,19149,William H. Ziegler School,7460,50592,,,,,,,,,,,,,,,,,,,,,
204,19137,Maritime Academy Charter School (MACHS),3366,52034,,,,,,,,,,,,,,,,,,,,,
205,19137,Bridesburg School,7470,52034,,,,,,,,,,,,,,,,,,,,,
206,19137,Franklin Towne Charter High School,3331,52034,,,,,,,,,,,,,,,,,,,,,
207,19137,Franklin Towne Charter Elementary School,3403,52034,,,,,,,,,,,,,,,,,,,,,
208,19150,John F. McCloskey School,6310,54121,,,,,,,,,,,,,,,,,,,,,
209,19150,Franklin S. Edmonds School,6210,54121,,,,,,,,,,,,,,,,,,,,,
210,19150,Hill-Freedman World Academy,6460,54121,106.0,65,61.32,585.0,175.0,29.91,410.0,70.09,244.0,41.71,339.0,57.95,483.0,82.56,16.0,2.74,100.0,86.0,14.69,102.0,44.12
212,19126,Ellwood School,7260,54936,,,,,,,,,,,,,,,,,,,,,
213,19126,General Louis Wagner School,7130,54936,,,,,,,,,,,,,,,,,,,,,
211,19126,William Rowen School,7530,54936,,,,,,,,,,,,,,,,,,,,,
214,19111,Kennedy C. Crossan School,8230,55569,,,,,,,,,,,,,,,,,,,,,
215,19111,Tacony Academy Charter School,3404,55569,,,,,,,,,,,,,,,,,,,,,
216,19111,Fox Chase School,8260,55569,,,,,,,,,,,,,,,,,,,,,
217,19111,Northeast High School,8020,55569,880.0,641,72.84,3271.0,321.0,9.81,2950.0,90.19,1463.0,44.73,1807.0,55.24,786.0,24.03,483.0,14.77,100.0,2002.0,61.21,659.0,55.39
218,19111,Laura H. Carnell School,7220,55569,,,,,,,,,,,,,,,,,,,,,
219,19111,Castor Gardens Middle School,8120,55569,,,,,,,,,,,,,,,,,,,,,
220,19111,Northeast High School EOP,3850,55569,27.0,5,18.52,198.0,32.0,16.16,166.0,83.84,86.0,43.43,112.0,56.57,98.0,49.49,25.0,12.63,2.42,75.0,37.89,,
221,19111,J. Hampton Moore School,8310,55569,,,,,,,,,,,,,,,,,,,,,
226,19136,Northeast Community Propel Academy,8130,56752,,,,,,,,,,,,,,,,,,,,,
227,19136,Abraham Lincoln High School,8010,56752,516.0,322,62.4,2175.0,401.0,18.44,1774.0,81.56,926.0,42.57,1248.0,57.38,700.0,32.18,373.0,17.15,100.0,1102.0,50.67,336.0,29.46
225,19136,Pennypack House School,8540,56752,37.0,11,29.73,91.0,52.0,57.14,39.0,42.86,7.0,7.69,84.0,92.31,73.0,80.22,5.0,5.49,0.0,13.0,14.29,,
222,19136,Edwin Forrest School,8250,56752,,,,,,,,,,,,,,,,,,,,,
223,19136,New Foundations Charter School,3334,56752,,,,,,,,,,,,,,,,,,,,,
224,19136,Joseph H. Brown School,8210,56752,,,,,,,,,,,,,,,,,,,,,
228,19152,Robert B. Pollock School,8410,56835,,,,,,,,,,,,,,,,,,,,,
229,19152,Louis H. Farrell School,8380,56835,,,,,,,,,,,,,,,,,,,,,
230,19152,Rhawnhurst School,8360,56835,,,,,,,,,,,,,,,,,,,,,
231,19152,Thomas Holme School,8270,56835,,,,,,,,,,,,,,,,,,,,,
232,19153,Penrose School,1440,57830,,,,,,,,,,,,,,,,,,,,,
240,19145,Stephen Girard School,2320,59216,,,,,,,,,,,,,,,,,,,,,
239,19145,"Preparatory Charter School of Mathematics, Science, Technology and Careers",3313,59216,,,,,,,,,,,,,,,,,,,,,
238,19145,Delaplaine McDaniel School,2370,59216,,,,,,,,,,,,,,,,,,,,,
237,19145,Universal Charter School at Audenried,3417,59216,,,,,,,,,,,,,,,,,,,,,
234,19145,Philadelphia Performing Arts: A String Theory Charter School,3336,59216,,,,,,,,,,,,,,,,,,,,,
235,19145,Girard Academic Music Program,2410,59216,58.0,58,100,577.0,35.0,6.07,542.0,93.93,330.0,57.19,245.0,42.46,141.0,24.44,229.0,39.69,61.56,207.0,35.87,58.0,70.69
233,19145,F. Amedee Bregy School,2240,59216,,,,,,,,,,,,,,,,,,,,,
236,19145,Universal Charter School at Vare,3418,59216,,,,,,,,,,,,,,,,,,,,,
245,19116,George Washington High School,8030,59390,338.0,245,72.49,1905.0,377.0,19.79,1528.0,80.21,799.0,41.94,1104.0,57.95,571.0,29.97,531.0,27.87,100.0,803.0,42.16,265.0,47.55
243,19116,William H. Loesche School,8440,59390,,,,,,,,,,,,,,,,,,,,,
244,19116,Philadelphia Academy Charter School,3322,59390,,,,,,,,,,,,,,,,,,,,,
241,19116,Watson Comly School,8370,59390,,,,,,,,,,,,,,,,,,,,,
242,19116,"Mathematics, Science, and Technology Community Charter School (MaST)",3328,59390,,,,,,,,,,,,,,,,,,,,,
246,19115,Anne Frank School,8400,62044,,,,,,,,,,,,,,,,,,,,,
247,19115,Joseph Greenberg School,8430,62044,,,,,,,,,,,,,,,,,,,,,
248,19115,Baldi School,8160,62044,,,,,,,,,,,,,,,,,,,,,
258,19148,Southwark School,2640,63497,,,,,,,,,,,,,,,,,,,,,
257,19148,Mastery Charter School at Thomas Campus,3385,63497,,,,,,,,,,,,,,,,,,,,,
256,19148,D. Newlin Fell School,2190,63497,,,,,,,,,,,,,,,,,,,,,
255,19148,Furness High School,2160,63497,190.0,139,73.16,822.0,122.0,14.84,700.0,85.16,319.0,38.81,503.0,61.19,146.0,17.76,53.0,6.45,96.35,623.0,75.79,147.0,32.65
254,19148,Abram S. Jenks School,2520,63497,,,,,,,,,,,,,,,,,,,,,
252,19148,South Philadelphia High School,2000,63497,190.0,118,62.11,635.0,192.0,30.24,443.0,69.76,263.0,41.42,372.0,58.58,241.0,37.95,52.0,8.19,100.0,342.0,53.86,131.0,12.21
251,19148,South Philadelphia High School EOP,3880,63497,36.0,16,44.44,105.0,13.0,12.38,92.0,87.62,65.0,61.9,40.0,38.1,75.0,71.43,4.0,3.81,1.52,26.0,24.76,,
250,19148,John H. Taggart School,2690,63497,,,,,,,,,,,,,,,,,,,,,
249,19148,George W. Sharswood School,2630,63497,,,,,,,,,,,,,,,,,,,,,
253,19148,Francis S. Key School,2540,63497,,,,,,,,,,,,,,,,,,,,,
260,19114,Swenson Arts and Technology High School,8090,70838,135.0,130,96.3,845.0,175.0,20.71,670.0,79.29,302.0,35.74,543.0,64.26,189.0,22.37,265.0,31.36,100.0,391.0,46.28,131.0,38.17
259,19114,John Hancock Demonstration School,8770,70838,,,,,,,,,,,,,,,,,,,,,
262,19119,Charles W. Henry School,6250,72685,,,,,,,,,,,,,,,,,,,,,
263,19119,Eleanor C. Emlen School,6220,72685,,,,,,,,,,,,,,,,,,,,,
261,19119,Henry H. Houston School,6260,72685,,,,,,,,,,,,,,,,,,,,,
264,19154,Stephen Decatur School,8420,79833,,,,,,,,,,,,,,,,,,,,,
265,19154,Arts Academy at Benjamin Rush,8040,79833,142.0,140,98.59,583.0,48.0,8.23,535.0,91.77,464.0,79.59,118.0,20.24,135.0,23.16,241.0,41.34,81.78,207.0,35.51,140.0,68.57
266,19154,A.L. Fitzpatrick School,8390,79833,,,,,,,,,,,,,,,,,,,,,
267,19154,MAST III Charter School,3445,79833,,,,,,,,,,,,,,,,,,,,,
272,19128,Lankenau High School,6540,80803,90.0,86,95.56,261.0,51.0,19.54,210.0,80.46,120.0,45.98,139.0,53.26,234.0,89.66,5.0,1.92,100.0,22.0,8.44,85.0,56.47
274,19128,Green Woods Charter School,3365,80803,,,,,,,,,,,,,,,,,,,,,
273,19128,Academy for the Middle Years at Northwest,6480,80803,,,,,,,,,,,,,,,,,,,,,
271,19128,Cook-Wissahickon School,6410,80803,,,,,,,,,,,,,,,,,,,,,
270,19128,Shawmont School,6380,80803,,,,,,,,,,,,,,,,,,,,,
269,19128,Roxborough High School,6030,80803,248.0,175,70.56,633.0,233.0,36.81,400.0,63.19,278.0,43.92,355.0,56.08,519.0,81.99,38.0,6.0,100.0,76.0,12.02,188.0,26.06
268,19128,Walter B. Saul High School,6040,80803,84.0,80,95.24,414.0,91.0,21.98,323.0,78.02,239.0,57.73,173.0,41.79,266.0,64.25,70.0,16.91,100.0,78.0,18.84,80.0,50.0
275,19127,James Dobson School,6450,81042,,,,,,,,,,,,,,,,,,,,,
276,19129,Thomas Mifflin School,6320,81641,,,,,,,,,,,,,,,,,,,,,
277,19129,A. Philip Randolph Career and Technical High School,6090,81641,54.0,45,83.33,436.0,143.0,32.8,293.0,67.2,156.0,35.78,280.0,64.22,356.0,81.65,11.0,2.52,100.0,69.0,15.82,45.0,15.56
278,19129,Philadelphia Hebrew Public Charter School,3446,81641,,,,,,,,,,,,,,,,,,,,,
285,19123,Young Scholars Charter School,3329,83008,,,,,,,,,,,,,,,,,,,,,
284,19123,"Math, Civics and Sciences Charter School",3321,83008,,,,,,,,,,,,,,,,,,,,,
287,19123,OIC CADI,8070,83008,77.0,14,18.18,153.0,24.0,15.69,129.0,84.31,86.0,56.21,67.0,43.79,133.0,86.93,0.0,0.0,100.0,20.0,13.07,,
283,19123,Ben Franklin High School EOP,3210,83008,42.0,5,11.9,152.0,18.0,11.84,134.0,88.16,85.0,55.92,67.0,44.08,125.0,82.24,1.0,0.66,0.0,26.0,17.11,,
286,19123,Spring Garden School,5560,83008,,,,,,,,,,,,,,,,,,,,,
281,19123,General Philip Kearny School,5480,83008,,,,,,,,,,,,,,,,,,,,,
